[
  {
    "id": "rage",
    "name": "Rage",
    "system": "PF1",
    "description": "Barbarian rage grants bonuses to Strength and Constitution and a penalty to AC.",
    "modifiers": [
      { "modifierTarget": "Strength", "modifierValue": 4 },
      { "modifierTarget": "Constitution", "modifierValue": 4 },
      { "modifierTarget": "Armor Class", "modifierValue": -2 }
    ],
    "durationRounds": 1,
    "colorId": "RED"
  },
  {
    "id": "power_attack",
    "name": "Power Attack",
    "system": "PF1",
    "description": "You take a penalty on attack rolls to gain a bonus on damage rolls.",
    "modifiers": [
      { "modifierTarget": "Attack Rolls", "modifierValue": -2 },
      { "modifierTarget": "Damage Rolls", "modifierValue": 4 }
    ],
    "durationRounds": 1,
    "colorId": "ORANGE"
  },
  {
    "id": "defensive_stance",
    "name": "Defensive Stance",
    "system": "PF1",
    "description": "You adopt a defensive posture, gaining bonuses to AC while suffering attack penalties.",
    "modifiers": [
      { "modifierTarget": "Armor Class", "modifierValue": 2 },
      { "modifierTarget": "Attack Rolls", "modifierValue": -1 }
    ],
    "durationRounds": 1,
    "colorId": "TEAL"
  },
  {
    "id": "total_defense",
    "name": "Total Defense",
    "system": "PF1",
    "description": "You focus entirely on defense, gaining a +4 dodge bonus to AC for 1 round.",
    "modifiers": [
      {
        "modifierType": "dodge",
        "modifierTarget": "Armor Class",
        "modifierValue": 4
      }
    ],
    "durationRounds": 1,
    "colorId": "TEAL"
  },
  {
    "id": "fight_defensively",
    "name": "Fight Defensively",
    "system": "PF1",
    "description": "You take a –4 penalty on attack rolls to gain a +2 dodge bonus to AC for 1 round.",
    "modifiers": [
      { "modifierTarget": "Attack Rolls", "modifierValue": -4 },
      {
        "modifierType": "dodge",
        "modifierTarget": "Armor Class",
        "modifierValue": 2
      }
    ],
    "durationRounds": 1,
    "colorId": "BROWN"
  },
  {
    "id": "charge",
    "name": "Charge",
    "system": "PF1",
    "description": "You charge into combat, gaining +2 to attack rolls but suffering –2 to AC until your next turn.",
    "modifiers": [
      { "modifierTarget": "Attack Rolls", "modifierValue": 2 },
      { "modifierTarget": "Armor Class", "modifierValue": -2 }
    ],
    "durationRounds": 1,
    "colorId": "ORANGE"
  },
  {
    "id": "improvised_weapon_penalty",
    "name": "Improvised Weapon Penalty",
    "system": "PF1",
    "description": "Using an improvised weapon incurs a –4 penalty on attack rolls.",
    "modifiers": [
      { "modifierTarget": "Attack Rolls", "modifierValue": -4 }
    ],
    "durationRounds": 1,
    "colorId": "RED"
  },
  {
    "id": "non_proficient_weapon_penalty",
    "name": "Non-Proficient Weapon Penalty",
    "system": "PF1",
    "description": "Using a weapon you are not proficient with incurs a –4 penalty on attack rolls.",
    "modifiers": [
      { "modifierTarget": "Attack Rolls", "modifierValue": -4 }
    ],
    "durationRounds": 1,
    "colorId": "RED"
  }
]
